,date_time,title
885847,2019-10-14 12:46:00-04:00,"A Look At Benzinga Pro's Most-Searched Tickers For October 14, 2019"
885848,2019-10-14 11:03:00-04:00,"Benzinga Pro's Top 9 Most-Searched Tickers For Morning of Monday, October 14, 2019"
885849,2019-10-14 10:36:00-04:00,"UPDATE: Raymond James On Netflix Also Notes 'Given subdued sentiment, we believe shares recover in November as investors get more comfortable with competition'"
885850,2019-10-14 10:36:00-04:00,"UPDATE: Raymond James Maintains Strong Buy On Netflix, Lowers Target To $415 As Firm Notes 'We proactively lowered our 3Q-4Q19E subs to reflect some pull forward from Stranger Things and near-term noise from competitor launches'"
885851,2019-10-14 10:06:00-04:00,"Earnings, Econ Numbers And The Beige Book Pepper The Second Round of The WeTrader Competition"
885852,2019-10-14 09:48:00-04:00,"Banks In Focus This Week As JPMorgan , Goldman Sachs, Others Report Tuesday"
885853,2019-10-14 08:25:00-04:00,10 Biggest Price Target Changes For Monday
885854,2019-10-14 08:16:00-04:00,"Raymond James Maintains Strong Buy on Netflix, Lowers Price Target to $415"
885855,2019-10-14 07:57:00-04:00,"Morgan Stanley Maintains Overweight on Netflix, Lowers Price Target to $400"
885856,2019-10-13 10:42:00-04:00,Can Netflix Deliver A Hit After Q2 Subscriber Disappointment?
885857,2019-10-12 18:10:00-04:00,Mike Khouw's Netflix Options Trade
885858,2019-10-11 13:15:00-04:00,Big Tech Earnings Season: Here's How Large Options Traders Are Positioning
885859,2019-10-10 10:11:00-04:00,Netflix shares are trading higher after multiple firms maintained bullish ratings on the company's stock.
885860,2019-10-10 09:57:00-04:00,Roku Gets Upgraded As It Accelerates Its Growth
885861,2019-10-10 09:14:00-04:00,"UBS Maintains Buy on Netflix, Lowers Price Target to $370"
885862,2019-10-10 08:34:00-04:00,"Goldman Sachs Maintains Buy on Netflix, Lowers Price Target to $360; Keeps On Conviction Buy List"
885863,2019-10-10 08:25:00-04:00,"Netflix Shares Down 1%; Hearing Several Firms Cut Price Target: Goldman From $420 To $360, UBS From $420 To $370"
885864,2019-10-09 16:24:00-04:00,What To Expect From Q3 Internet Earnings
885865,2019-10-09 09:57:00-04:00,"Rosenblatt Maintains Neutral on Netflix, Lowers Price Target to $265"
885866,2019-10-09 09:55:00-04:00,"Monness Crespi Hardt Maintains Buy on Netflix, Lowers Price Target to $340"
885867,2019-10-08 12:28:00-04:00,"Streaming Wars, Social Media And 5G: Comms Sector Earnings Preview"
885868,2019-10-08 10:10:00-04:00,"As Trade Talks Approach, ""Barometer"" Stocks Like Apple And Boeing Could Be In Focus"
885869,2019-10-08 09:58:00-04:00,Eyeball Wars: Streaming Services View For Consumer Attention
885870,2019-10-08 09:53:00-04:00,Survey Shows Teens Prefer YouTube Over Netflix
885871,2019-10-08 09:39:00-04:00,Netflix Signs Deal With Mediaset To Produce Italian Films
885872,2019-10-07 16:54:00-04:00,Investors Sell FANG To Buy IPOs In September's IMX
885873,2019-10-07 14:57:00-04:00,Best And Worst Short Ideas Of The Week
885874,2019-10-07 13:18:00-04:00,Investor Movement Index Summary: September 2019
885875,2019-10-07 09:23:00-04:00,"Evercore ISI Group Maintains In-Line on Netflix, Lowers Price Target to $300"
885876,2019-10-05 12:00:00-04:00,"Barron's Picks And Pans: Netflix, Raytheon, Spotify, Taiwan Semi And More"
885877,2019-10-05 09:54:00-04:00,"Martin Scorsese: Marvel Movies Are Like Theme Parks, Not 'Cinema'"
885878,2019-10-04 12:20:00-04:00,The Latest Battle In The Streaming Wars: Advertising
885879,2019-10-04 11:36:00-04:00,Netflix Option Alert: Fri $270 Puts Sweep (3) near the Bid: 1200 @ $0.59 vs 1663 OI; Earnings 10/16 After Close Ref=$273.38
885880,2019-10-04 11:23:00-04:00,'Exclusive data that predicted Netflix's big Q2 subscriber miss suggests international growth has bounced back' -Business Insider
885881,2019-10-04 10:32:00-04:00,Disney Bans Netflix Ads As Streaming's Marketing Wars Intensify
885882,2019-10-04 10:27:00-04:00,Netflix Option Alert: Oct 18 $285 Calls at the Ask: 648 @ $9.6 vs 16962 OI; Earnings 10/16 After Close Ref=$271.61
885883,2019-10-03 12:29:00-04:00,"A Look At Benzinga Pro's Most-Searched Tickers For October 3, 2019"
885884,2019-10-03 12:26:00-04:00,Netflix Working With Italian Tax Authorities Over Probe By Milan Prosecutors
885885,2019-10-03 10:46:00-04:00,"Despite Heavy Blows, Roku Is More Than Ready To Lift-Off Again"
885886,2019-10-03 10:22:00-04:00,Italian Broadcaster Mediaset Will Partner With Netflix To Produce Movies In Italy
885887,2019-10-03 10:19:00-04:00,Netflix shares are trading lower after an Italian prosecutor opened a probe for alleged tax evasion targeting the company.
885888,2019-10-03 10:11:00-04:00,"Benzinga Pro's Top 10 Most-Searched Tickers For Morning of Thursday, October 3, 2019"
885889,2019-10-03 03:58:00-04:00,Italian Prosecutors Open Probe for Alleged Tax Evasion Targeting  Netflix
885890,2019-10-02 12:44:00-04:00,"A Look At Benzinga Pro's Most-Searched Tickers For October 2, 2019"
885891,2019-10-02 11:07:00-04:00,"Cramer Gives His Opinion On iRobot, Netflix And More"
885892,2019-10-02 09:43:00-04:00,Netflix Shares Down 1.8%; Hearing 7 Park Data Showed Softness In Int'l. Subscriber Data
885893,2019-10-02 09:40:00-04:00,Netflix Option Alert: Oct 11 $265 Calls Sweep (65) near the Ask: 551 @ $6.2 vs 1070 OI; Earnings 10/16 After Close Ref=$264.385
885894,2019-10-02 09:24:00-04:00,"Benzinga Pro's Top 10 Most-Searched Tickers For Morning of Wednesday, October 2, 2019"
885895,2019-10-01 13:16:00-04:00,"Mark Cuban Owns Almost $1B Of Amazon Stock, Calls It The 'Best Startup In The World'"
885896,2019-10-01 05:09:00-04:00,Netflix Begins Production on 'The Incredible Story Of Rose Island'
885897,2019-09-30 14:49:00-04:00,Looking At The Newest S&P 500 Sector One Year Later
885898,2019-09-30 13:31:00-04:00,Netflix Renews Stranger Things For Season 4; Also Signs Series Creators To Multi-year Film And Series Deal
885899,2019-09-30 12:56:00-04:00,8 Latest Short Seller Targets
885900,2019-09-28 15:22:00-04:00,"Barron's Picks And Pans: American Airlines, Chipotle, GM, Wells Fargo, More"
885901,2019-09-28 14:40:00-04:00,"Bulls And Bears Of The Week: Apple, Netflix, McDonald's, Visa, More"
885902,2019-09-27 14:32:00-04:00,Netflix Analyst Eyes Complications Of A 'Hit-Driven Business'
885903,2019-09-27 09:57:00-04:00,Report: Apple's Hollywood Ambitions Bigger Than Thought
885904,2019-09-27 09:56:00-04:00,"Company Focus: Micron Under Pressure On Guidance, But Wells Fargo Up On CEO News"
885905,2019-09-26 11:04:00-04:00,Peloton Investor On Why Others Should Buy The Stock
885906,2019-09-25 14:37:00-04:00,Netflix shares are trading higher after Credit Suisse maintained an Outperform rating on the stock.
885907,2019-09-25 13:01:00-04:00,"Credit Suisse On Netflix Also Notes 'Shares have already pulled back sharply on concerns regarding competition, content costs, and 3Q sub growth, each of which is priced in or overdone, in our view'"
885908,2019-09-25 13:01:00-04:00,"Credit Suisse Maintains Outperform, $440 Target On Netflix As Firm Notes '3Q19 App Downloads Update: Last 3 Weeks Softer'; 'as of 3 weeks ago, 3Q to date global downloads were up 20% Y/Y, and now, including 3 more weeks of data, they are up only 6% Y/Y'"
885909,2019-09-25 12:49:00-04:00,"A Look At Benzinga Pro's Most-Searched Tickers For September 25, 2019"
885910,2019-09-25 09:25:00-04:00,"Benzinga Pro's Top 10 Most-Searched Tickers For Morning of Wednesday, September 25, 2019"
885911,2019-09-24 16:20:00-04:00,"Netflix, Twitter And More 'Fast Money Halftime Report' Picks From September 24"
885912,2019-09-24 13:30:00-04:00,Analyst Calls WWE A 'Precious Stone In Media'
885913,2019-09-24 11:27:00-04:00,"Wells Fargo Initiates On Media Stocks, Disney Among Top Picks"
885914,2019-09-24 10:49:00-04:00,"Netflix shares are trading lower after receiving negative sentiment from multiple sell-side firms. Wells Fargo initiated coverage with a Market Perform rating and said the company is ""at a turning point with investors,"" and Pivotal Research lowered the price target from $515 to $350."
885915,2019-09-24 10:39:00-04:00,Netflix Shares Unaffected Amid Report 'Jim Cramer says Netflix 'has become an open sore to this market''
885916,2019-09-24 10:14:00-04:00,Wells Fargo Says Netflix Is At A Turning Point
885917,2019-09-24 09:46:00-04:00,"Benzinga's Top Upgrades, Downgrades For September 24, 2019"
885918,2019-09-24 08:57:00-04:00,10 Biggest Price Target Changes For Tuesday
885919,2019-09-24 08:54:00-04:00,"UPDATE: Wells Fargo On Netflix Also Notes 'We'd be bullish when the valuation reflects maturity at say, 20-30x CY20E estimated EV/EBITDA, and more clarity on the FCF profile'"
885920,2019-09-24 08:54:00-04:00,"UPDATE: Wells Fargo On Netflix Notes 'At 50x CY20E estimated EV/EBITDA, ~6x EV/Sales, and an imponderable FCF yield (we don't expect break-even cash until 2022), there's too much opportunity for the KPI interplay to yield' Disappointing Results Seen In Q2"
885921,2019-09-24 08:54:00-04:00,"UPDATE: Wells Fargo Initiates Netflix With Market Perform, $288 Target As Firm Thinks Co. 'is at a turning point with investors'; Notes If Co. Hikes 'pricing or content too much and FCF expectations may suffer'"
885922,2019-09-24 07:28:00-04:00,"Pivotal Research Maintains Buy on Netflix, Lowers Price Target to $350"
885923,2019-09-24 06:17:00-04:00,"Wells Fargo Initiates Coverage On Netflix with Market Perform Rating, Announces $288 Price Target"
885924,2019-09-23 12:27:00-04:00,Netflix shares trading lower following a late-Friday comment from CEO Reed Hastings at the RTS TV Conference about increasing production costs in the face of new competition. Today saw some bearish put activity in the October $265 contract.
885925,2019-09-22 11:03:00-04:00,'Seinfeld' Will Have A Few New Homes In 2021
885926,2019-09-20 14:16:00-04:00,Large Option Trader Aggressively Dumping Netflix Calls
885927,2019-09-20 12:24:00-04:00,"A Look At Benzinga Pro's Most-Searched Tickers For September 20, 2019"
885928,2019-09-20 11:03:00-04:00,Netflix Option Alert: Oct 18 $285 Calls Sweep (37) near the midpoint: 907 @ $8.848 vs 10952 OI; Earnings 10/16 After Close Ref=$271.92
885929,2019-09-20 10:48:00-04:00,"Needham's Martin Talks Apple Services, Streaming Video Competition"
885930,2019-09-20 10:47:00-04:00,'Netflix CEO admits there will be 'tough competition' as streaming wars heat up with Apple and Disney' -CNBC
885931,2019-09-20 10:17:00-04:00,Pivotal Research Explains Roku Bear Thesis
885932,2019-09-20 09:38:00-04:00,Netflix CEO Reed Hastings Earlier Suggested The Co. Will Make A 'Big' Increase In Its Investment In UK TV Production In 2020
885933,2019-09-20 09:38:00-04:00,"Netflix shares trading lower following comments from an Evercore ISI analyst suggesting recent data checks were soft, creating uncertainty about the company's int'l. subscriber growth."
885934,2019-09-20 09:18:00-04:00,"Benzinga Pro's Top 10 Most-Searched Tickers For Morning of Friday, September 20, 2019"
885935,2019-09-19 14:10:00-04:00,"Bernstein On Netflix Notes 'Taking the lower of: a) current multiple (33x EBITDA), or b) 2 std deviations below average (4.5x Sales), decreasing our EBITDA forecast by 10%, the theoretical ""floor"" for NFLX would be $230'"
885936,2019-09-19 10:35:00-04:00,Netflix Co-Founder On Corporate Culture: Customer Always Comes First
885937,2019-09-18 14:19:00-04:00,"How Facebook, Comcast Just Shook Up The Streaming Video Wars"
885938,2019-09-18 13:50:00-04:00,Netflix May Base Film Bonuses On Viewership Or Number Of Awards; Plans To Pay Bonuses To Filmmakers When Movies Succeed
885939,2019-09-18 12:27:00-04:00,"Netflix shares are trading lower after Comcast announced Xfinity Flex, a streaming service which will be free to its broadband customers."
885940,2019-09-18 08:51:00-04:00,Netflix Shares Down 1.7% Following Headline Comcast CEO Says Will Offer Streaming Media Set Top Box 'Xfinity Flex' For Free To Broadband Customers
885941,2019-09-17 14:09:00-04:00,'NBC's 'Peacock' streaming service to launch in April with 'The Office' and 'Parks and Recreation'' -Recent MarketWatch Article
885942,2019-09-16 12:31:00-04:00,'Jerry & Elaine & George & Kramer & Netflix All 180 episodes of the Emmy-Award winning Seinfeld are coming to Netflix — worldwide! — starting in 2021' -Tweets Netflix
885943,2019-09-16 10:01:00-04:00,"Vivendi's Pay-TV Unit Canal+ Set To Offer Netflix Movies, Series To Subs"
885944,2019-09-13 14:32:00-04:00,Netflix shares trading higher for the third day in a row. Not seeing company-specific news to justify the move higher. The stock rebounded after testing a recent low of $282.66 on Tuesday.
885945,2019-09-11 16:45:00-04:00,How Much Does It Cost: Apple TV+ Vs. Disney+ Vs. Hulu Vs. Netflix Vs. Amazon Prime
885946,2019-09-11 13:23:00-04:00,'Former Netflix exec: Apple's streaming service will 'absolutely' be able to compete' -CNBC
885947,2019-09-11 09:58:00-04:00,Follow-Through Wednesday? Stocks Look To Build On Late Tuesday Rally
885948,2019-09-11 09:10:00-04:00,Analyst: Comparing Apple TV+ With Netflix Isn't Fair
885949,2019-09-11 09:01:00-04:00,UPDATE: Bank Of America On Apple TV+ Also Notes 'We recognize the limited content at launch but Netflix launched 13 original shows in 2013 (not dissimilar to Apple's launch) and Apple can build content by deploying capital'
885950,2019-09-11 07:25:00-04:00,12 Stocks With The Most Earnings Upside Potential
885951,2019-09-11 04:15:00-04:00,"Mexico Tax on Netflix, Spotify, Others Could Raise $185M According to Senior Lawmaker"
885952,2019-09-10 15:38:00-04:00,"What We Learned From Apple's Event: Arcade, TV+, iPad, Watch Series 5 And iPhone 11"
885953,2019-09-10 13:44:00-04:00,"Apple TV+ Price Will Start At $4.99 A Month, Launch Nov. 1"
885954,2019-09-10 13:21:00-04:00,Netflix shares are trading lower after Apple unveiled details of Apple TV+.
885955,2019-09-10 13:20:00-04:00,"Apple's Tim Cook Says If Users Buy An Apple Device, Will Get 1 Year Of Apple TV+ For Free"
885956,2019-09-10 13:20:00-04:00,"Netflix, Disney Shares Fall Following Unveiling Of Details For Apple TV+"
885957,2019-09-10 04:45:00-04:00,"Sasha Bühler Joins Netflix as Director Of Original Film For Germany, France & Nordics"
885958,2019-09-09 10:32:00-04:00,"Benzinga Pro's Top 10 Most-Searched Tickers For Morning of Monday., September 09, 2019"
885959,2019-09-09 10:17:00-04:00,How Passive Investing's Focus On Momentum Rather Than Value Kills Real Economic Growth
885960,2019-09-09 10:01:00-04:00,"Netflix shares are trading higher after Bank of America noted the company's downloads are tracking up 30% sequentially, they also see significant reacceleration in Q3."
885961,2019-09-09 09:17:00-04:00,"Bank Of America, Citing SensorTower, Says Netflix Downloads Tracking Up 30% Sequentially, Says Seeing Significant Reacceleration In Q3"
885962,2019-09-07 14:55:00-04:00,Facebook Dating Vs. Match.com Vs. Tinder
885963,2019-09-06 11:45:00-04:00,"A Look At Benzinga Pro's Most-Searched Tickers For September 6, 2019"
885964,2019-09-06 11:14:00-04:00,"Jim Cramer Shares His Thoughts On Netflix, Beyond Meat And More"
885965,2019-09-06 10:01:00-04:00,"Benzinga Pro's Top 10 Most-Searched Tickers For Morning of Friday., September 06, 2019"
885966,2019-09-05 13:56:00-04:00,Netflix Option Alert: Sep 20 $305 Calls at the Ask: 655 @ $2.46 vs 2600 OI; Earnings 10/15 After Close [est] Ref=$290.91
885967,2019-09-05 09:19:00-04:00,Netflix Shares Down 0.6% Over Last Few Mins.; Hearing 7Park Research Said Co.'s Q3 Could Be 'Light' Amid Int'l. Shortfall
885968,2019-09-03 12:51:00-04:00,"Shares of several large-cap companies are trading lower as trade concerns continue to escalate following a new 15% tariff, which was added to $112 billion worth of Chinese goods on Sunday."
885969,2019-09-03 08:26:00-04:00,"This New Entertainment Product Combines Cannabis, Hip Hop Stars, TV, Sci-Fi And Books"
885970,2019-09-03 06:34:00-04:00,Head of Turkey's Television Watchdog Says Netflix Has Applied for License Under Turkey's Online Broadcasting Guidelines
885971,2019-08-31 15:37:00-04:00,"Bulls And Bears Of The Week: Altria, Apple, Netflix, Slack And More"
885972,2019-08-29 12:58:00-04:00,Media Exec: Disney Has 'Awful Lot To Work With' But Netflix Is 'Formidable'
885973,2019-08-29 09:03:00-04:00,10 Biggest Price Target Changes For Thursday
885974,2019-08-29 07:56:00-04:00,"UPDATE: Imperial Capital Maintains Outperform On Netflix, Lowers Target To $451 As Firm Notes 'Our FY19 EBITDA and EPS estimates decline slightly due to higher marketing expense and higher technology costs overseas'"
885975,2019-08-29 06:09:00-04:00,"Imperial Capital Maintains Outperform on Netflix, Lowers Price Target to $451"
885976,2019-08-28 14:45:00-04:00,Option Trader Makes Massive Bets On Netflix Rebound
885977,2019-08-28 07:55:00-04:00,Here Are All The Ways To Watch NFL Football Without Cable
885978,2019-08-27 09:56:00-04:00,Tuesday's Market Minute: Disney+ & Hulu: The Whole Package?
885979,2019-08-26 13:58:00-04:00,Shares of several large-cap companies are trading higher amid easing trade tensions. President Trump said China is ready to come back to the negotiating table.
885980,2019-08-26 12:06:00-04:00,Good Show! UK Watchers Stream To Netflix
885981,2019-08-23 09:58:00-04:00,Shares of several large-cap companies are trading lower in sympathy with the overall market on escalated trade tensions after China announced it plans to impose a 5% to 10% tariff rate on $75 billion worth of U.S. goods.
885982,2019-08-20 11:12:00-04:00,Netflix shares are trading lower after Apple announced pricing for its streaming service and reportedly committed $5 billion more to its original content budget. This news added to concerns of competitive pressures on Netflix from Apple and Disney.
885983,2019-08-20 04:19:00-04:00,Netflix Adds 'Latest' Section to Its TV App
885984,2019-08-19 12:07:00-04:00,Shares of several large-cap companies are trading higher on renewed optimism for a solution to the U.S.-China trade war.
885985,2019-08-16 11:53:00-04:00,Shares of several large-cap companies are trading higher with the broader market on renewed optimism surrounding US-China trade talks after Donald Trump announced earlier in the week that he would delay additional tariffs on Chinese goods until December.
885986,2019-08-15 13:40:00-04:00,"Q2 13F Roundup: How Buffett, Einhorn, Ackman And Others Adjusted Their Portfolios"
885987,2019-08-14 16:43:00-04:00,Mario Gabelli Sees Good Value In CBS
885988,2019-08-14 16:25:00-04:00,"Soros 13F Shows New Stake In Annaly Capital, Liquidated Stakes In Coty, Netflix"
885989,2019-08-14 11:07:00-04:00,"CBS, Viacom To Merge: What Comes Next?"
885990,2019-08-14 10:22:00-04:00,"Shares of several large-cap companies are trading lower after the spread between the 2-year and 10-year yield curve inverted, potentially signaling a recession."
885991,2019-08-13 06:09:00-04:00,"Third Point Raises Stake In Netflix By 25% To 500,000 Shares"
885992,2019-08-12 14:17:00-04:00,Roku Vs. Netflix: Needham Compares Streaming Stocks
885993,2019-08-10 15:22:00-04:00,"Notable Insider Buys This Past Week: Dish, JPMorgan, Netflix"
885994,2019-08-09 14:55:00-04:00,"Flat Subscription Rate, Custom Algorithms And Mobile Plans: Meet iFlip"
885995,2019-08-08 13:58:00-04:00,Shares are several consumer technology companies are trading higher in sympathy with the overall market.
885996,2019-08-08 03:34:00-04:00,"Netflix Wins Overall Film, TV Deal For 'Game Of Thrones' Creators David Benioff & D.B. Weiss"
885997,2019-08-07 10:23:00-04:00,Shares of several large-cap companies are trading lower in sympathy with the overall market
885998,2019-08-07 10:16:00-04:00,"Bob Iger Talks Disney's 'Transitional' Q3 With CNBC, Highlights Streaming Business"
885999,2019-08-07 09:17:00-04:00,Trader Toolkit: Under The Hood Of One Of The Most Popular Technical Indicators
886000,2019-08-05 11:14:00-04:00,Shares of several large-cap companies are trading lower with the overall market on renewed US-China trade tensions. President Trump announced an additional 10% tariff on $300 billion worth of Chinese goods. China is manipulating its currency and announced they are not buying any agricultural products from the U.S.
886001,2019-08-05 10:25:00-04:00,Bank Of America Moderates Netflix Bull Vs. Bear Debate After Q2 Print
886002,2019-08-02 16:22:00-04:00,Analysts Share Their View On FANG Stocks And Apple
886003,2019-07-31 15:49:00-04:00,'I Didn't Want To Die': Why One Woman Turned To Trading Options To Fund Life-Extending Stem Cell Treatments
886004,2019-07-31 10:52:00-04:00,"Morning Comment: Apple, Netflix And Boeing Facing Key Technical Levels"
886005,2019-07-31 10:06:00-04:00,"'Facebook Approached Netflix, Disney to Support TV Chat Device' -The Information"
886006,2019-07-29 12:22:00-04:00,Netflix Shares Unaffected Amid Report Co. Investing $520M+ To Make 3 'Big Budget' Films
886007,2019-07-28 08:18:00-04:00,"@elonmusk Tweet Ability to stream YouTube & Netflix when car is stopped coming to your Tesla soon! Has an amazingly immersive, cinematic feel due to the comfy seats & surround sound audio."
886008,2019-07-26 12:49:00-04:00,"Movie Analyst: When It Comes To Marvel, Less Is More"
886009,2019-07-26 07:18:00-04:00,"Disney, Netflix And More 'Fast Money Halftime Report' Picks For July 25"
886010,2019-07-25 15:52:00-04:00,What To Do About Fraudulent Transactions On Your Online Bank Account
886011,2019-07-25 14:38:00-04:00,Netflix shares are trading higher after potentially on a correction after a large sell-off due to low Q2 net subscriber adds.
886012,2019-07-24 17:28:00-04:00,"Netflix, WWE And More 'Fast Money Halftime Report' Picks From July 24"
886013,2019-07-24 15:50:00-04:00,Netflix shares are trading higher after potentially on a correction after a large sell-off due to low Q2 net subscriber adds.
886014,2019-07-24 13:02:00-04:00,Netflix Option Alert: Aug 2 $335 Calls Sweep (97) near the Ask: 755 @ $1.458 vs 621 OI; Ref=$318.06
886015,2019-07-24 12:46:00-04:00,'Streaming Service Iflix Exiting The Middle East Amid Growing Distributor Frustration' -Deadline
886016,2019-07-24 04:12:00-04:00,Netflix Launches Rs 199 ($2.80) Mobile-only Monthly Plan in India
886017,2019-07-23 10:36:00-04:00,"AT&T, Verizon Earnings On Tap With The 5G Era In Sight"
886018,2019-07-22 10:36:00-04:00,"Netflix shares are trading lower on continuation after the company reported Q2 net subscriber adds of 2.7 million, below the 5 million forecast."
886019,2019-07-22 10:30:00-04:00,8 Of The Best Investments For Boomers Concerned About Retirement
886020,2019-07-22 10:03:00-04:00,"Key Earnings Week As Amazon, Boeing, Alphabet, Facebook Results All Expected"
886021,2019-07-21 17:42:00-04:00,Netflix Signs First Direct Contract Agreement With SAG-AFTRA
886022,2019-07-20 09:48:00-04:00,"Barron's Picks And Pans: FedEx, Netflix, Softbank, Target And More"
886023,2019-07-19 12:39:00-04:00,"A Look At Benzinga Pro's Most-Searched Tickers For July 19, 2019"
886024,2019-07-19 11:52:00-04:00,Morning Comment: What Is The Future Of Netflix?
886025,2019-07-19 11:42:00-04:00,Eddie Murphy Could Become $70M Richer Thanks To Netflix
886026,2019-07-19 11:01:00-04:00,"Benzinga Pro's Top 10 Most-Searched Tickers For Morning of Friday., July 19, 2019"
886027,2019-07-19 09:51:00-04:00,Microsoft Results Have Market Feeling Better About Earnings Season
886028,2019-07-19 05:02:00-04:00,58 Biggest Movers From Yesterday
886029,2019-07-18 16:25:00-04:00,'Lion King' Release Might Be A Good Time To Look At Disney's Stock
886030,2019-07-18 13:00:00-04:00,Large Option Trades Hint At How Institutions Are Playing The Netflix Dip
886031,2019-07-18 12:57:00-04:00,42 Stocks Moving In Thursday's Mid-Day Session
886032,2019-07-18 12:05:00-04:00,"A Look At Benzinga Pro's Most-Searched Tickers For July 18, 2019"
886033,2019-07-18 11:40:00-04:00,Analysts Weigh In On Netflix's Rocky Quarter
886034,2019-07-18 11:07:00-04:00,"Canaccord Genuity Maintains Buy On Netflix, Maintains $415 Tgt As Firm Still Sees 'strong content strategy and room to add large numbers of international subs as key strengths going forward' Despite Subscriber Net Add Miss, Pricing Power Questions"
886035,2019-07-18 10:44:00-04:00,"Benzinga Pro's Top 10 Most-Searched Tickers For Morning of Thursday, July 18, 2019"
886036,2019-07-18 10:23:00-04:00,Netflix Short Sellers Up $800M On Subscriber Miss
886037,2019-07-18 10:21:00-04:00,"Worries Over Progress On Trade, Earnings Uncertainty Cloud Market Sentiment"
886038,2019-07-18 10:14:00-04:00,"Morgan Stanley On Netflix Also Notes 'in the last three years, Netflix has missed its quarterly net additions once a year, so 2Q19 may prove to be 2019's only miss. In all three of these cases it has outperformed meaningfully the following quarter'"
886039,2019-07-18 10:14:00-04:00,"Morgan Stanley Reiterates Buy On Netflix, Reiterates $450 Target As Firm Notes 'Netflix missed 2Q net adds by over 2mm. Did the world change in the last three months? We do not believe it did'"
886040,2019-07-18 09:54:00-04:00,10 Biggest Price Target Changes For Thursday
886041,2019-07-18 09:51:00-04:00,What Caused The Opening Gap In Netflix?
886042,2019-07-18 09:44:00-04:00,Thursday's Market Minute: Netflix Continues To Take A Bite Out Of The FANG Index
886043,2019-07-18 08:42:00-04:00,"Citigroup Maintains Buy on Netflix, Lowers Price Target to $410"
886044,2019-07-18 08:31:00-04:00,"Credit Suisse Reiterates Outperform on Netflix, Lowers Price Target to $440"
886045,2019-07-18 08:28:00-04:00,"BMO Capital Maintains Outperform on Netflix, Lowers Price Target to $440"
886046,2019-07-18 08:26:00-04:00,"Wedbush Maintains Underperform on Netflix, Raises Price Target to $188"
886047,2019-07-18 08:24:00-04:00,"Nomura Maintains Neutral on Netflix, Lowers Price Target to $310"
886048,2019-07-18 08:05:00-04:00,28 Stocks Moving In Thursday's Pre-Market Session
