,date_time,title
887402,2017-09-12 11:55:00-04:00,"Netflix Shares At Session Highs, Now Up 1.3% As Co. CFO Wells Currently Speaking At Goldman's Communacopia Conference"
887403,2017-09-12 11:26:00-04:00,Netflix CFO David Wells Currently Speaking At Goldman's Communacopia Conference: Says 'We're Seeing The Momentum Of Shift To Internet Entertainment Pick Up Steam'
887404,2017-09-12 09:39:00-04:00,5 Biggest Price Target Changes For Tuesday
887405,2017-09-12 09:16:00-04:00,"Goldman Sachs Communacopia Conference Begins Today, Presenters Include: Netflix, Level 3, Altice USA, Charter Communications, Frontier Communications, MDC Partners, News Corp, Lamar Advertising, AT&T, and Comcast"
887406,2017-09-11 08:41:00-04:00,Movie Studios Blame Rotten Tomatoes For Box Office Woes
887407,2017-09-10 20:41:00-04:00,Anxious For Netflix's Q3 Results? Here's A Primer
887408,2017-09-08 16:07:00-04:00,"Storms, Streaming And 'Star Wars': An Updated Disney Outlook"
887409,2017-09-08 11:48:00-04:00,"Disney's CEO Hypes New Streaming Service: It's Gonna Be Big, It's Gonna Be Hot"
887410,2017-09-07 15:28:00-04:00,"Netflix Spokesperson Tells Benzinga Its U.S. Subscribers Will Continue To Have Access To Disney, Marvel & Star Wars Films 'Through End Of 2019 And 2020 In Many Cases'"
887411,2017-09-07 13:46:00-04:00,"Disney Rattles Media Sector On Pullback Of Marvel, 'Star Wars' Offering"
887412,2017-09-07 11:29:00-04:00,"Entire Media Space Moving Following Report Marvel, Star Wars Will Go Exclusively To Disney's Streaming Service: Netflix Shares Down ~$1.50, Comcast Down ~$0.30, CBS Down ~$1.05, 21st Century Fox Down ~$0.30, Discovery Down ~$0.20"
887413,2017-09-07 10:34:00-04:00,T-Mobile's 'Netflix On Us' Initiative Isn't Enough To Warrant An Upgrade From Deutsche Bank
887414,2017-09-06 15:56:00-04:00,"How Many People Still Use CDs, VCRs And Landline Phones? More Than You Might Think"
887415,2017-09-06 13:46:00-04:00,Netflix Higher Following T-Mobile Deal
887416,2017-09-06 11:27:00-04:00,T-Mobile To Bundle Netflix Subscription With New Family Plans
887417,2017-09-06 11:06:00-04:00,T-Mobile Announces Partnership With Netflix To Offer Free Subscription For Every ONE Family Plan At No Extra Charge
887418,2017-09-06 11:06:00-04:00,Netflix Shares Up Very Slightly Over Last Few Mins As Wednesday's Biggest Bar Of Volume Crosses
887419,2017-09-06 10:32:00-04:00,UPDATE: The EU Presidency Proposal Related To Taxing Digital Multinationals Will Be Discussed By EU Finance Ministers Next Week
887420,2017-09-06 10:31:00-04:00,UPDATE: EU Tax Overhaul Would Require Digital Cos. To Be Taxed Where They Make Profits Regardless Of Tax Residence
887421,2017-09-06 10:30:00-04:00,Watching Internet Stocks Amid Headline EU Is Planning Int'l Rules Overhaul To Raise Tax Bill For Online Giants
887422,2017-09-05 15:40:00-04:00,Is There Room For A 'Positive' Media Company? Chicken Soup Entertainment Thinks So
887423,2017-09-04 13:12:00-04:00,Amazon's Emphasis Of Market Share Over Profits Could Keep Whole Food's Prices Low
887424,2017-09-03 12:19:00-04:00,Emagine Entertainment Aims For Movie Theater 'Magnificence' With Caramel Corn And Super Screens
887425,2017-08-31 17:09:00-04:00,Vetr Crowd Downgrades Netflix
887426,2017-08-31 10:20:00-04:00,Jobs Watch: Key Payrolls Data Up Tomorrow As Market Ends Summer On Upswing
887427,2017-08-31 08:29:00-04:00,Few Surprises With This Tech ETF
887428,2017-08-30 11:50:00-04:00,Analyst: Netflix Losing Disney Doesn't Matter Because Most Markets Never Had Disney Content In The First Place
887429,2017-08-29 09:07:00-04:00,Cloud ETF Is A Viable Long-Term Idea
887430,2017-08-27 15:36:00-04:00,Cramer: August Has Proven To Be A Useless Month For Stocks
887431,2017-08-27 15:33:00-04:00,The 7 'Gremlins' That Could Haunt The Stock Market
887432,2017-08-25 14:38:00-04:00,Surprising Stocks Lead This Week's Rebound
887433,2017-08-25 03:42:00-04:00,Watch These 7 Huge Put Purchases In Friday Trade
887434,2017-08-24 16:03:00-04:00,Forbes Fab 5 Among Actors And Actresses: Did They Earn Their Keep?
887435,2017-08-24 11:25:00-04:00,Netflix Option Alert: Sep 29 $167.5 Puts at the Bid: 500 @ $6.25 vs 178 OI; Ref=$166.79
887436,2017-08-24 10:38:00-04:00,Netflix Option Alert: Apr 20 $160 Puts at the Bid: 950 @ $15.301 vs 0 OI; Ref=$168.14
887437,2017-08-24 10:17:00-04:00,Cramer Identifies What's Wrong With The 'FANG' Group
887438,2017-08-21 15:45:00-04:00,"Who Is Paul Meeks, And Why Should You Care That He's Bullish On The FANG Stocks?"
887439,2017-08-21 08:21:00-04:00,Fast Money Picks For Aug. 21
887440,2017-08-20 11:03:00-04:00,"Benzinga's Bulls & Bears From The Week: Home Depot, Netflix, Walmart And More"
887441,2017-08-19 09:44:00-04:00,Cramer Finds A Way To Explain Stock Diversification With Fantasy Football
887442,2017-08-16 13:40:00-04:00,The Netflix Effect Is Only Half The Story For Disney
887443,2017-08-16 08:44:00-04:00,Netflix: Buy The Disney Dip
887444,2017-08-15 15:35:00-04:00,Highlights From Q2's 13-F Season
887445,2017-08-15 13:50:00-04:00,"If Bitcoin Were A Stock, It Would Be Valued Similar To Netflix"
887446,2017-08-15 13:26:00-04:00,Netflix To Capture ABC's Female Following With Rhimes Deal
887447,2017-08-15 09:21:00-04:00,So What's The Difference Between YouTube And Facebook's New 'Watch'?
887448,2017-08-14 15:03:00-04:00,"13F From Tiger Global Shows Reduced Stake In Alibaba To 4.3M Shares, Reduces Stake In Netflix To 376K Shares"
887449,2017-08-14 13:27:00-04:00,"Daydreamers Line Up As OTT, Cable Networks, Film Studios Battle For Content Creators"
887450,2017-08-14 10:36:00-04:00,13F From Omega Shows Slight Reduction In Netflix Position From 77.7K Shares To 65K Shares
887451,2017-08-14 08:42:00-04:00,Netflix's Subscriber Numbers Will See 'Very Little' Impact From Disney Deal Cancellation
887452,2017-08-14 08:28:00-04:00,The Market In 5 Minutes
887453,2017-08-14 04:32:00-04:00,Netflix Signs Shonda Rhimes to Multi-year Production Deal -Variety
887454,2017-08-13 18:05:00-04:00,Barron's Ponders The Future Of Netflix
887455,2017-08-11 10:17:00-04:00,"That's Rich: Highest-Paid Comics Who Laughed All The Way To The Bank, Thanks To Netflix"
887456,2017-08-11 08:31:00-04:00,The Market In 5 Minutes
887457,2017-08-10 15:47:00-04:00,WWE Network Enters China Just In Time For SummerSlam
887458,2017-08-10 09:28:00-04:00,Disney Downer: When A Movie That Makes $860 Million Is A Drag On Earnings
887459,2017-08-10 09:28:00-04:00,The Market In 5 Minutes
887460,2017-08-10 07:35:00-04:00,Fast Money Traders Share Their Thoughts On Disney-Netflix Split
887461,2017-08-10 04:40:00-04:00,Watch These 7 Huge Put Purchases In Thursday Trade
887462,2017-08-09 15:50:00-04:00,Top 10 Reasons We're Excited For David Letterman's Return On Netflix
887463,2017-08-09 13:39:00-04:00,Jason Calacanis Shares His Thoughts On Disney's Streaming Plans
887464,2017-08-09 12:07:00-04:00,Long Live The King? Disney Takes Streaming Into Its Own Hands
887465,2017-08-09 11:38:00-04:00,Netflix Option Alert: Sep 1 $170 Puts Sweep (29) at the Bid: 1000 @ $3.651 vs 361 OI; Ref=$173.75
887466,2017-08-09 09:34:00-04:00,Disney Vs. Netflix: Content Is King As Big Media Seeks To Capture Cord-Cutting Consumers
887467,2017-08-09 08:34:00-04:00,The Market In 5 Minutes
887468,2017-08-09 08:19:00-04:00,18 Stocks Moving In Wednesday's Pre-Market Session
887469,2017-08-08 17:18:00-04:00,"UPDATE: Netflix Tells Benzinga It Continues To Do Business With Walt Disney 'On Many Fronts,' Including 'Ongoing Relationship With Marvel TV'"
887470,2017-08-08 17:17:00-04:00,"Netflix Responds To Disney Pulling Content From Platform; Tells Benzinga Its Members Will Have Access To Disney Films Through End Of 2019, Including All Theatrical Releases Through End Of 2018"
887471,2017-08-08 17:02:00-04:00,"Disney To Launch ESPN Streaming Service, Leave Netflix By 2019"
887472,2017-08-08 16:06:00-04:00,"Disney Says 'Disney will end its distribution agreement with Netflix for subscription streaming of new releases, beginning with the 2019 calendar year theatrical slate.'"
887473,2017-08-08 11:23:00-04:00,CNBC Now Tweets: JUST IN: David Letterman is coming back to TV thanks to Netflix cnb.cx/2vipL3X
887474,2017-08-08 10:40:00-04:00,The 3 Financial Statements You Need To Know For Stock Research
887475,2017-08-08 07:03:00-04:00,"Wall Street's M&A Chatter From August 7: Eros Group, Netflix-Millarworld, United Technologies-Rockwell Collins, Fresenius Medical-NxStage"
887476,2017-08-07 16:07:00-04:00,Comic Book Writer Mark Millar: 4 Things You May Not Know About Netflix's Movie-Spawning New Superstar
887477,2017-08-07 14:29:00-04:00,"Smartphone App Downloads: Facebook Reigns, Snap Lags, Twitter Doesn't Crack Top 10"
887478,2017-08-07 11:47:00-04:00,Netflix Shares Largely Unaffected As Traders Circulating Article 'Iflix raises $133m as it dominates Netflix in parts of Asia'
887479,2017-08-07 09:01:00-04:00,"Netflix To acquire Comic Book Bo. Millarworld, Terms Not Disclosed"
887480,2017-08-03 13:25:00-04:00,"Bloomberg Reporter Lucas Shaw Tweets: Analyst (Porter Bibb) tells @BloombergRadio that Netflix is going to go bankrupt if it doesn't sell to Google, Facebook or Amazon. H/t @henryseltzer"
887481,2017-08-03 12:09:00-04:00,Jim Cramer's One Issue With Tesla's Earnings Report
887482,2017-08-03 10:25:00-04:00,"As Netflix Tackles Suicidal Issues, Hospital Psych Units Grapple With Real-Life Consequences"
887483,2017-08-02 08:58:00-04:00,Piper's Olson On Netflix: 'Obviously [co.] continues to perform well. We think there is a huge opportunity for the company to capture int'l subscribers'
887484,2017-08-01 15:24:00-04:00,Oaktree's Co-Chairman On FAANG Stocks: Valuations Are High But Coming Down
887485,2017-08-01 11:02:00-04:00,Traders Circulating Brightwire Rumor That Netflix Is In Talks With Chunghwa Telecom On OTT Streaming
887486,2017-08-01 10:27:00-04:00,All Eyes On iPhone As Apple Kicks Off August With Earnings After Closing Bell
887487,2017-07-31 16:46:00-04:00,"Why The 'Game Of Thrones' Leak Is a Big Deal For Fans, But Not The Stock"
887488,2017-07-31 14:15:00-04:00,Discovery Acquires Scripps Network In $11.9 Billion Deal
887489,2017-07-31 13:14:00-04:00,"Discovery Shares Plunge On Earnings, News Of $14.6 Billion Deal To Acquire Scripps Interactive"
887490,2017-07-30 10:12:00-04:00,It's OK To Stay On The Sidelines With Popular Stocks
887491,2017-07-30 10:10:00-04:00,Is Roku's Speculated IPO A Viable Option Right Now?
887492,2017-07-29 09:54:00-04:00,Expert: Predicted 37% Pop In TV Retransmission Fees A 'Natural Righting Of The Ship'
887493,2017-07-27 15:01:00-04:00,The JPMorgan Mid-Day Note That Might Have Sent The Market Falling
887494,2017-07-27 14:31:00-04:00,Are Options Traders Betting On A Big Move In Nektar Stock?
887495,2017-07-27 12:11:00-04:00,"Facebook's Stock Has Another 25% Upside Despite Some Problems Ahead, Analyst Says"
887496,2017-07-27 10:08:00-04:00,Video Streaming Is Coming To Nintendo Switch
887497,2017-07-26 09:56:00-04:00,5 Biggest Price Target Changes For Wednesday
887498,2017-07-25 08:17:00-04:00,Cloud Computing ETF Reaches For The Sky
887499,2017-07-24 15:45:00-04:00,Analyst Says 31 Million Homes Could Cut Cord On Legacy Media; New Study Shows 64% Of U.S. Households Now Stream Programs
887500,2017-07-24 14:28:00-04:00,Charter Communication Q2 Earnings: What's In Store?
887501,2017-07-24 13:56:00-04:00,This Week In Stocks: Choppy Action
887502,2017-07-24 11:29:00-04:00,"With Alphabet's Earnings On Deck, Consider Long- Vs. Short-Term Investing Strategies"
887503,2017-07-24 10:56:00-04:00,"TechCrunch Reports Netflix Was Top Grossing App In Q2, With Mobile Sales Up 233% Since Last Year"
887504,2017-07-24 10:09:00-04:00,"Netflix Wowed Investors With Its Earnings Report, Will Fellow 'FANG' Member Amazon Follow Suit?"
887505,2017-07-23 17:21:00-04:00,"Scientists Store Film Clip In DNA, Pave The Way For AR Experience Sharing"
887506,2017-07-22 16:36:00-04:00,Tech Sector Finally Recovers From The Dot-Com Bubble Of 2000
887507,2017-07-21 11:26:00-04:00,"Verizon Addresses Accusations Of Bandwidth Manipulation Limiting Netflix, YouTube Streaming"
887508,2017-07-21 09:53:00-04:00,9to5Mac Publishes 'Verizon allegedly throttling Netflix & YouTube even before usage limits hit; VPN circumvents'
887509,2017-07-21 09:06:00-04:00,"Cramer: Ahead Of FANG Earnings, Don't 'Feel Foolish For Pulling The Trigger'"
887510,2017-07-21 07:05:00-04:00,"Golar, Microsoft, Netflix, Xilinx: Fast Money Picks For July 21"
887511,2017-07-20 15:48:00-04:00,"Forget FANG, Trade FATS: A Preview Of Facebook, Alphabet, Twitter And Snap Earnings"
887512,2017-07-19 13:19:00-04:00,Traders Bail On This Leveraged ETF As Earnings Roll In
887513,2017-07-19 10:08:00-04:00,Caution Still The Watchword But Stocks Hit Record Highs As Earnings Mostly Strong
887514,2017-07-19 08:30:00-04:00,Cramer: Netflix Just Reaffirmed It Can 'Grow And Grow And Grow'
887515,2017-07-18 16:28:00-04:00,11 Wall Street Analysts Weigh In On Netflix's Blowout Quarter
887516,2017-07-18 14:32:00-04:00,Mid-Afternoon Market Update: Netflix Gains Following Q2 Results; Ericsson Shares Plummet
887517,2017-07-18 14:16:00-04:00,The Market Is Discounting T-Mobile's Growth
887518,2017-07-18 12:42:00-04:00,7 Reasons Why The Street Likes The Netflix Q2 Beat
887519,2017-07-18 12:25:00-04:00,12 Biggest Mid-Day Gainers For Tuesday
887520,2017-07-18 12:22:00-04:00,"Netflix Defies Bears Once More With Strong Q2, Solid Guidance"
887521,2017-07-18 11:49:00-04:00,Cramer: Netflix Proves It Belongs In The 'FANG' Group
887522,2017-07-18 11:12:00-04:00,Exclusive: Mark Cuban Sees Half A Billion Subscribers Ahead For Netflix
887523,2017-07-18 11:11:00-04:00,"In Reaction To Netflix Earnings Report, Mark Cuban Tells Benzinga The Company Needs To Continue To 'Stay in startup mode', Says Netflix Can Reach 500 Million Subs In Next 10 Years"
887524,2017-07-18 10:51:00-04:00,Finding A Way: Banks Beat Expectations Despite Struggles As Earnings Go Into High Gear
887525,2017-07-18 10:43:00-04:00,Content Is King: Expect Further Upside For Netflix
887526,2017-07-18 10:07:00-04:00,The Netflix Growth Story Renewed For Another Season
887527,2017-07-18 09:52:00-04:00,5 Biggest Price Target Changes For Tuesday
887528,2017-07-18 09:32:00-04:00,"Benzinga's Top Upgrades, Downgrades For July 18, 2017"
887529,2017-07-18 09:03:00-04:00,The Market In 5 Minutes
887530,2017-07-18 08:32:00-04:00,Rosenblatt Raises Netflix Target To $200 After Quarter That Was 'Just Too Good'
887531,2017-07-18 08:08:00-04:00,22 Stocks Moving In Tuesday's Pre-Market Session
887532,2017-07-18 07:19:00-04:00,A Peek Into The Markets: U.S. Stock Futures Mostly Flat Ahead Of Goldman Sachs Earnings
887533,2017-07-18 07:08:00-04:00,Rosenblatt Upgrades Netflix to Buy
887534,2017-07-18 05:19:00-04:00,"10 Stocks To Watch For July 18, 2017"
887535,2017-07-17 16:19:00-04:00,Netflix Vs. Amazon: On-Demand Video Market Is Big Enough For Both
887536,2017-07-17 16:18:00-04:00,"Netflix Sees Q3 EPS ~$0.32 vs $0.23 Est., Sales ~$2.969B vs $2.87B Est."
887537,2017-07-17 16:08:00-04:00,Netflix Says 'Good Progress' In Int'l Expansion To Result In 'positive international contribution profit for the full year 2017'
887538,2017-07-17 16:07:00-04:00,Netflix Sees Q3 Int'l Net Sub Adds 3.65M
887539,2017-07-17 16:06:00-04:00,Netflix Reports Q2 EPS $0.15 vs $0.16 Est.
887540,2017-07-17 16:05:00-04:00,"Netflix Reports Q2 Sales $2.79B vs $2.76B Est., Net Sub Adds 1.07M Domestic, 4.14M Int'l"
887541,2017-07-17 15:46:00-04:00,Netflix Shares Up 0.5% Ahead Of After-Hours Earnings Report; BZ NOTE: Netflix Qtr. Results Are Historically Released By 4:05 or 4:06 p.m. EDT
887542,2017-07-17 14:42:00-04:00,"Earnings Preview: Financial Giants BAC, GS, And MS Report Q2 Results This Week"
887543,2017-07-17 14:11:00-04:00,"5 Stocks To Watch This Week - NFLX, BAC, IBM, V, EBAY"
887544,2017-07-17 12:29:00-04:00,"Netflix Strikes Balance Between Content And Spending, But Stock Trading Like A Takeover Target"
887545,2017-07-17 12:04:00-04:00,Has All The Negative Sentiment Over Cord-Cutting Turned Entertainment Stocks Into A Bear Trap?
887546,2017-07-17 10:36:00-04:00,Netflix Earnings Preview: What Might Be Expected From Q2 2017?
887547,2017-07-17 10:31:00-04:00,Can Netflix's Q2 Earnings Propel The Stock To Record Territory?
887548,2017-07-17 10:10:00-04:00,5 Biggest Price Target Changes For Monday
887549,2017-07-17 07:35:00-04:00,A Peek Into The Markets: U.S. Stock Futures Edge Higher; Netflix Earnings In Focus
887550,2017-07-17 06:52:00-04:00,David Seaburg Is Bullish On Netflix Ahead Of Earnings
887551,2017-07-17 05:49:00-04:00,"6 Stocks To Watch For July 17, 2017"
887552,2017-07-17 05:06:00-04:00,"Earnings Scheduled For July 17, 2017"
887553,2017-07-16 13:33:00-04:00,Master Of All Trades: Every Industry Jeff Bezos Has A Hand In
887554,2017-07-16 13:01:00-04:00,Mike Khouw's Netflix Options Trade
887555,2017-07-15 10:38:00-04:00,"Emmy 2017: Streaming, Premium Cable Earns More And More Recognition"
887556,2017-07-14 14:10:00-04:00,Expect A Positive Inflection Heading Into Netflix's Q2
887557,2017-07-14 14:04:00-04:00,"Prime Day, Emmy Nominees, And Netflix Earnings Preview"
887558,2017-07-14 08:46:00-04:00,Tech ETFs Are Still Tempting
887559,2017-07-13 15:08:00-04:00,"5 Sectors Millennials Prefer To Consumer Goods, And The Stocks That Prove It"
887560,2017-07-13 14:32:00-04:00,What's Going Down At The Allen & Company Sun Valley Conference
887561,2017-07-13 12:29:00-04:00,Cramer Questions Wedbush's Bearish Netflix Thesis
887562,2017-07-13 10:06:00-04:00,6 Biggest Price Target Changes For Thursday
887563,2017-07-13 05:09:00-04:00,Morgan Stanley Raises Netflix PT to $185 from $175
887564,2017-07-12 12:28:00-04:00,An ETF For The FANG Group Arrives
887565,2017-07-12 11:36:00-04:00,Startup City Is Littered With Lost Billions In Investments: Here Are 6 Obits From 2017
887566,2017-07-12 10:16:00-04:00,5 Takeaways From The 'Future Of Media Summit'
887567,2017-07-12 06:51:00-04:00,"American Air, Bank Of America, Celgene, Netflix: Fast Money Picks For July 12"
887568,2017-07-10 15:07:00-04:00,Netflix Shares Setting Up Nicely Into Q2 Results
887569,2017-07-09 19:03:00-04:00,9 Best Monthly Subscriptions You Can Try For Free
887570,2017-07-09 16:14:00-04:00,Malaysia Internet Exchange to Finalize Deal With Netflix by End of August -Bernama
887571,2017-07-06 07:04:00-04:00,"Netflix, Viacom, Visa: Fast Money Picks For July 6"
887572,2017-07-05 08:27:00-04:00,Looking At QQQ For The Second Half
887573,2017-07-03 12:33:00-04:00,Verizon Going After Disney? Maybe.
887574,2017-07-03 08:26:00-04:00,Cramer To Parents: Invest In Your Kid's Future ASAP
887575,2017-07-01 11:53:00-04:00,For The Content Hungry: Cloud Or Cable?
887576,2017-06-29 08:41:00-04:00,Marc Chaikin Launches The 'Pandora Of Fintech' Stock Discovery Engine
887577,2017-06-28 09:43:00-04:00,Cramer: The Best Investors Are ... Disinterested Teens
887578,2017-06-27 13:54:00-04:00,"Salesforce CEO Talks FANG Stocks, Singles Out Upside In Amazon's AWS"
887579,2017-06-27 11:14:00-04:00,FAANG And Fed: Tech Stocks In Focus After E.U. Fines Alphabet And Yellen Speaks Today
887580,2017-06-26 14:16:00-04:00,Traders Circulating Engadget Article 'Vimeo axes plans for its Netflix-esque subscription service'
887581,2017-06-26 13:32:00-04:00,"'Dr Doom': Even If The Dow Goes To 100,000, It Will 'End Very Badly' For Investors"
887582,2017-06-25 14:50:00-04:00,"In Honor Of GLOW, Here Are The Most Groundbreaking Women In WWE History"
887583,2017-06-25 14:33:00-04:00,"Benzinga's Bulls & Bears For The Past Week: Netflix, AMD, Colgate And More"
887584,2017-06-22 09:22:00-04:00,Netflix Releases First Build-Your-Own-Adventure Movie
887585,2017-06-21 10:18:00-04:00,"Netflix Shares Up 1.6%; Traders Circulating Chatter Of Notable Investor Stake; BZ NOTE: Unconfirmed Rumors Are Numerous This Morning, Watch For Near-Term Profit Taking From Session Highs"
887586,2017-06-20 15:02:00-04:00,Analysis: Why Netflix Remains 'Best Idea In The Media Industry'
887587,2017-06-20 13:57:00-04:00,European Stocks Find Their Own Rally Off Of French Parliamentary Election
887588,2017-06-20 09:51:00-04:00,5 Biggest Price Target Changes For Tuesday
887589,2017-06-19 16:05:00-04:00,"Netflix To Report Q2 Results Monday, July 17th Appox. 4:05pm ET"
887590,2017-06-18 17:29:00-04:00,Benzinga's Bulls And Bears For The Past Week: FANG Stocks And Big Mergers
887591,2017-06-15 16:10:00-04:00,Steve Sosnick's Bearish Netflix Trade
887592,2017-06-15 10:54:00-04:00,"Factors Driving FANG Still Intact, But Macro Backdrop More Mixed"
887593,2017-06-15 09:51:00-04:00,Canaccord Downgrades Google: 4 Reasons This FANG Stock Gets The Bite
887594,2017-06-15 09:24:00-04:00,The Vetr Community Continues To Love Netflix
887595,2017-06-14 12:01:00-04:00,Milestone: More People Are Now Willing To Pay For Netflix Than Traditional Cable TV
887596,2017-06-13 15:20:00-04:00,Will Movie Theaters Survive What Netflix Has Up Its Up Its Sleeves?
887597,2017-06-13 13:34:00-04:00,New Data Show Gamers Spend Almost Half Console Time Not Playing Games
887598,2017-06-13 08:28:00-04:00,FAANG Weakness Problematic For Plenty Of ETFs
887599,2017-06-12 14:09:00-04:00,"Don't Buy This Tech Dip, Notable Internet Analyst Says"
887600,2017-06-12 12:10:00-04:00,The 9 Best S&P 500 Stocks Of The Past 15 Years
887601,2017-06-12 10:44:00-04:00,Tech Sector Set To Lead Stocks Lower Again
887602,2017-06-12 04:23:00-04:00,"Altice, Netflix Sign Global Partnership in France, Portugal, Israel, Dominican Republic"
887603,2017-06-09 12:32:00-04:00,"Tech Stocks Leading Stock Market Lower Over Last 30 Mins: Salesforce Down 2.4%, Netflix Down 2.2%, Applied Materials Down 2.1%, Apple Down 1.8%, Google, Amazon, Adobe Down 1.3%,"
887604,2017-06-08 09:01:00-04:00,The Market In 5 Minutes
887605,2017-06-07 16:42:00-04:00,Netflix Vs. Amazon Prime: The Battle For Apple TV Screen Time
887606,2017-06-07 12:51:00-04:00,Strategist: FANG Stocks Can Still Grow In A Sluggish Economy
887607,2017-06-06 16:45:00-04:00,"Paul Meeks Ran The Biggest Tech Fund During The Dot-Com Bubble, And He's Worried About Today's Market"
887608,2017-06-06 09:55:00-04:00,5 Biggest Price Target Changes For Tuesday
887609,2017-06-06 09:00:00-04:00,"Companies Holding Shareholder Meetings Today Include: Acacia Research, BioMarin Pharmaceutical, AMC Networks, Live Nation Entertainment, Kate Spade, IMAX, GoPro, Netflix, Sarepta, Salesforce, TJX Companies, And Tesla"
887610,2017-06-02 11:43:00-04:00,"Cramer: The Market Is 'All FANG All The Time,' But It Shouldn't Be"
887611,2017-06-01 13:48:00-04:00,FAANG Stocks Will Remain Hot
887612,2017-05-31 16:53:00-04:00,Amazon Is Scary Even To Netflix's Reed Hastings
887613,2017-05-31 16:16:00-04:00,Notable Netflix Analyst Explains Why Amazon Isn't A Competitor
887614,2017-05-31 11:31:00-04:00,Netflix CEO Hastings on CNBC Says Launching In China Is Off The Table For The Next Couple of Years
887615,2017-05-31 11:30:00-04:00,"Netflix CEO Hastings on CNBC Says They Have To Be The Specialty Play, They Can't 'Out-Amazon, Amazon'"
887616,2017-05-31 11:29:00-04:00,"Netflix CEO Hastings on CNBC Says Amazon Is Awfully Scary, But Not Sure If It's Their Biggest Threat"
887617,2017-05-31 11:28:00-04:00,"Netflix CEO Hastings on CNBC Says They Have No Plans On News And Sports Expansion, Says They Are Tough Businesses"
887618,2017-05-31 11:23:00-04:00,Netflix CEO Hastings on CNBC Says He Is Open To Getting Content In Movie Theaters And Giving Consumers Choice
887619,2017-05-31 11:21:00-04:00,"Netflix Shares Tick to Recent Highs, Still Down ~0.4% for Session, as Chair, CEO, Reed Hastings, Currently Speaking on CNBC"
887620,2017-05-31 11:20:00-04:00,"Netflix CEO Reed Hastings on CNBC Says As Membership Base Grows, Content Spending Will Need To Increase Much More"
887621,2017-05-30 12:46:00-04:00,Subscription-Based Services Make A Big Push Into India
887622,2017-05-29 20:20:00-04:00,"Benzinga's Bulls And Bears For The Past Week: Ford, Kroger, Netflix And More"
887623,2017-05-29 14:59:00-04:00,Partner Communications Announces Collaboration with Netflix in Israel
887624,2017-05-27 18:44:00-04:00,'90s Nostalgia: 7 Shows We Want Back On TV
887625,2017-05-26 09:19:00-04:00,Notable Netflix Analyst Says Stock Could See Another 67% Gain
887626,2017-05-25 14:01:00-04:00,An Ellen Special Is Coming To Netflix + 3 Other Hotly-Anticipated Titles For 2017
887627,2017-05-25 11:29:00-04:00,Netflix Makes New All-Time High After Price Target Raise
887628,2017-05-25 10:17:00-04:00,10 Interesting Things You Might Not Know About Pornhub
887629,2017-05-25 10:04:00-04:00,5 Biggest Price Target Changes For Thursday
887630,2017-05-25 09:59:00-04:00,Netflix Season 2 Episode 1: Expectations For International May Be Way Too Conservative
887631,2017-05-25 08:12:00-04:00,"PiperJaffray Maintains Overweight on Netflix, Raises PT From $166 To $190"
887632,2017-05-23 12:05:00-04:00,The 'House Of Cards' Season 5 Debut May Be A Reason To Own Netflix Shares
887633,2017-05-23 07:41:00-04:00,Fast Money Traders Share Their Thoughts On Netflix
887634,2017-05-22 11:28:00-04:00,Notable Netflix Analyst Thinks The Market Is Big Enough For Everyone
887635,2017-05-20 09:19:00-04:00,Comparing Big Tech Stocks On Fundamentals
887636,2017-05-19 05:10:00-04:00,Netflix's 'Oka' Booed at Cannes Following Technical Malfunction -Hollywood Reporter
887637,2017-05-17 10:27:00-04:00,Facebook Consolidation Culminates With Earnings Gap Fill
887638,2017-05-16 15:46:00-04:00,"Alphabet Soup, Revisited: 'FAANG,' Not 'FAANGSTN'"
887639,2017-05-16 10:20:00-04:00,"Microsoft's Enduring Advantage Keeps Analysts, Investors Bullish"
887640,2017-05-15 16:57:00-04:00,13F from Soros' Soros Fund Mgmt Shows Reduced Stake in Netflix
887641,2017-05-15 14:26:00-04:00,13F Shows Tiger Global Management Took A Stake In Netflix Of 429K Shares
887642,2017-05-15 11:23:00-04:00,"13F from Cooperman's Omega Shows New Stakes in Lowe's, Ramaco Resources, Mirati Therapeutics, Netflix, Parsley Energy, Rev Group, Sinclair Broadcast, Tri Pointe Group, WPX Energy"
