,date_time,title
886464,2018-11-08 04:33:00-05:00,Netflix Chief Content Officer Ted Sarandos  Says Plans to Introduce 17 New Original Productions from Asia
886465,2018-11-07 13:38:00-05:00,"Several Net-Neutrality-sensitive stocks sharply higher today as US House shifting toward Democrats could be positive for Net Neutrality landscape: Amazon Shares Up 10%, Netflix Up 5.3%, Roku Up 5%"
886466,2018-11-07 13:30:00-05:00,"Several Net-Neutrality-Sensitive Stocks Sharply Higher Wed. As US House Shifting Toward Democrats Could Be Positive For Net Neutrality Landscape: Amazon Shares Up 10%, Netflix Up 5.3%, Roku Up 5%"
886467,2018-11-07 11:30:00-05:00,"Tariffs, Drug Prices, Legislative Gridlock: What Economists Are Watching Following The Midterm Election"
886468,2018-11-06 10:06:00-05:00,Long Wait Is Over: Election Day Dawns With Markets Under Light Pressure
886469,2018-11-06 08:54:00-05:00,Here's What's At Stake For Your Investments In The 2018 Midterms
886470,2018-11-05 15:10:00-05:00,From Bearish To Bullish: Buckingham Upgrades Netflix
886471,2018-11-05 09:51:00-05:00,10 Biggest Price Target Changes For Monday
886472,2018-11-05 09:05:00-05:00,"Benzinga's Top Upgrades, Downgrades For November 5, 2018"
886473,2018-11-05 08:52:00-05:00,"Buckingham Upgrades Netflix to Buy, Raises Price Target to $406"
886474,2018-11-01 16:26:00-04:00,6 Music Stocks To Watch In 2019
886475,2018-11-01 04:49:00-04:00,Netflix to Screen 'Roma' Weeks Ahead of Streaming
886476,2018-10-31 11:14:00-04:00,"Analysts Stay Bullish On iQiyi After Q3 Print, But Investors Unhappy With Lower Ad Revenue"
886477,2018-10-29 16:46:00-04:00,"The Latest Tech Wreck Sends Markets Lower; S&P 500, Nasdaq Close In Correction Territory"
886478,2018-10-29 09:43:00-04:00,Snap Shares Up ~2% Mon. Morning; Weekend Article From Techcrunch: 'Should cash-strapped Snapchat sell out? To Netflix?'
886479,2018-10-28 10:46:00-04:00,"Bulls & Bears Of The Week: Caterpillar, eBay, Intel, Morgan Stanley And More"
886480,2018-10-26 09:56:00-04:00,"Stock Rally Looks Poised To Falter After Amazon, Alphabet Results Disappoint"
886481,2018-10-26 07:44:00-04:00,"Amazon, Netflix, Apple Dominate Among Teens"
886482,2018-10-25 17:15:00-04:00,"'At Netflix, Radical Transparency and Blunt Firings Unsettle the Ranks' -WSJ"
886483,2018-10-25 13:16:00-04:00,"Loup Ventures Finds Phoneless Experiment Freeing, Frustrating"
886484,2018-10-24 11:25:00-04:00,Spotify's Recent Weakness Doesn't Change Morgan Stanley's Bullish Tune
886485,2018-10-23 16:00:00-04:00,"Netflix, Roku Shares Appear Unaffected Following The Information Article 'Apple to Launch TV Subscription Service Globally'"
886486,2018-10-23 15:17:00-04:00,How To Use Pivot Points In Your Trading
886487,2018-10-23 14:57:00-04:00,Podcast: FAANG Stocks In The Spotlight As Earnings Season Trudges Along
886488,2018-10-23 13:25:00-04:00,"Netflix Prices €1.1B 4.625% Senior Notes Due 2029, $800M 6.375% Senior Notes Due 2029"
886489,2018-10-23 11:35:00-04:00,"Hearing Lead Underwriters For Netflix, Euro Tranches Bond Offering Said Offer Launched At 'Wider Than Price Talk'"
886490,2018-10-22 09:00:00-04:00,Netflix Reports $2B Senior Notes Offering
886491,2018-10-21 18:17:00-04:00,"Bulls & Bears Of The Week: Apple, Disney, Ford, Home Depot And More"
886492,2018-10-19 10:59:00-04:00,"Wedbush Adds Apple To Best Ideas List, Sees Opportunity In iPhone Upgrades Next Year"
886493,2018-10-18 13:55:00-04:00,S&P Downgrades Netflix From B+ to BB-; Outlook Lowered From Positive to Stable
886494,2018-10-18 12:15:00-04:00,Netflix Tells Employees To Brace For WSJ Investigation Of Company Culture
886495,2018-10-18 09:50:00-04:00,The 'Fab 5' Stocks — And Why They're So Important To The Rally
886496,2018-10-18 04:47:00-04:00,46 Biggest Movers From Yesterday
886497,2018-10-17 16:53:00-04:00,"10 Hottest Stocks From October 17, 2018"
886498,2018-10-17 13:45:00-04:00,"Benzinga Pro's Top 10 Most-Searched Tickers For Afternoon Of Wed., Oct. 17, 2018"
886499,2018-10-17 12:49:00-04:00,36 Stocks Moving In Wednesday's Mid-Day Session
886500,2018-10-17 12:01:00-04:00,Mid-Day Market Update: Crude Oil Down 2.7%; vTv Therapeutics Shares Spike Higher
886501,2018-10-17 11:16:00-04:00,The Street Reacts To Netflix's Q3
886502,2018-10-17 10:30:00-04:00,Mid-Morning Market Update: Markets Open Lower; Abbott Laboratories Posts In-Line Q3 Earnings
886503,2018-10-17 10:24:00-04:00,"After Basking In The Glow Of Netflix Results And Tuesday Rally, Pressure Seems Possible"
886504,2018-10-17 10:03:00-04:00,10 Biggest Price Target Changes For Wednesday
886505,2018-10-17 09:09:00-04:00,"Benzinga's Top Upgrades, Downgrades For October 17, 2018"
886506,2018-10-17 09:02:00-04:00,"Raymond James Maintains Outperform on Netflix, Raises Price Target to $435"
886507,2018-10-17 08:43:00-04:00,"KeyBanc Downgrades Netflix, Cites A Need For Stronger Revenue Growth"
886508,2018-10-17 08:39:00-04:00,"Buckingham Maintains Underperform on Netflix, Raises Price Target to $349"
886509,2018-10-17 08:06:00-04:00,31 Stocks Moving In Wednesday's Pre-Market Session
886510,2018-10-17 08:03:00-04:00,"Citigroup Maintains Buy on Netflix, Raises Price Target to $400"
886511,2018-10-17 07:53:00-04:00,"BMO Capital Maintains Outperform on Netflix, Raises Price Target to $440"
886512,2018-10-17 07:45:00-04:00,"Canaccord Genuity Maintains Buy on Netflix, Raises Price Target to $470"
886513,2018-10-17 07:27:00-04:00,"Netflix shares are trading higher after the company reported EPS of $0.89 beating the $0.68 consensus estimate and revenue of $4.00B, inline with the consensus estimate. Netflix added 6.96M new streaming subscribers in the quarter."
886514,2018-10-17 07:21:00-04:00,iQIYI shares are trading higher after Netflix reported stronger than expected third quarter earnings results. iQIYI runs a service similar to Netflix for the Chinese market.
886515,2018-10-17 07:16:00-04:00,A Peek Into The Markets: US Stock Futures Down Ahead Of Fed Minutes
886516,2018-10-17 05:36:00-04:00,KeyBanc Downgrades Netflix to Sector Weight
886517,2018-10-17 05:21:00-04:00,"8 Stocks To Watch For October 17, 2018"
886518,2018-10-16 22:20:00-04:00,YouTube Was Down For Many Users Tuesday Night
886519,2018-10-16 16:51:00-04:00,Netflix shares are up 11.7% following Q3 earnings; The company beat EPS estimates but slightly missed on sales.
886520,2018-10-16 16:50:00-04:00,7 Stocks Moving In Tuesday's After-Hours Session
886521,2018-10-16 16:33:00-04:00,"10 Hottest Stocks From October 16, 2018"
886522,2018-10-16 16:23:00-04:00,"Facebook Shares Up 0.8% After Hours Following Netflix Earnings, Subsequent Move Higher In NFLX; Amazon Up 1%, Apple Up 0.4%, Google Shares Unchanged"
886523,2018-10-16 16:22:00-04:00,iQIYI Shares Indicated Up 4% On ~222.5K Shares After Hours Following Favorable Reaction To Netflix's Mixed Q3 Earnings Report
886524,2018-10-16 16:20:00-04:00,Netflix Soars After Big Q3 Earnings Beat
886525,2018-10-16 16:17:00-04:00,UPDATE: Netflix Highlights Expected Sequential Decline In Operating Margin Amid 'to the timing of content spend and a higher mix of original films in Q4'18'
886526,2018-10-16 16:13:00-04:00,Netflix Sees Q4 Operating Margin Falling From 7.5% In Q4'17 To 5%
886527,2018-10-16 16:13:00-04:00,Netflix Reaffirms FY18 Operating Margin Guidance At Lower End Of 10-11% Range
886528,2018-10-16 16:11:00-04:00,"Netflix Shares Up 13.6% Following Mixed Q3 Earnings Report, Below-Expectation Q4 Guidance"
886529,2018-10-16 16:06:00-04:00,Netflix Sees Q4 Total Streaming Net Additions 9.4M
886530,2018-10-16 16:05:00-04:00,"Netflix Q3 Total Streaming Net Additions 6.96M, US Streaming Net Adds 1.09M, Int'l. Streaming Net Adds 5.87M"
886531,2018-10-16 16:04:00-04:00,"Netflix Sees Q4 EPS $0.23 Does Not Compare To $0.51 Est., Sales $4.2B vs $4.23B Est."
886532,2018-10-16 16:04:00-04:00,"Netflix Q3 EPS $0.89 Beats $0.68 Estimate, Adj. EBITDA $584.145M, Sales $3.999B Miss $4B Estimate"
886533,2018-10-16 15:46:00-04:00,Netflix Expected To Report Q3 Earnings After The Closing Bell; Co. Historically Issues Its Report Between 4:00 And 4:10 p.m. ET
886534,2018-10-16 15:36:00-04:00,"Benzinga Pro's Top 10 Most-Searched Tickers For Afternoon Of Tues., Oct. 16, 2018"
886535,2018-10-16 12:57:00-04:00,Netflix Option Alert: Fri $365 Calls Sweep (4) near the Ask: 802 @ $5.29 vs 3796 OI; Earnings 10/16 After Close Ref=$338.4788
886536,2018-10-16 10:43:00-04:00,Bank Earnings To The Rescue? Market Seeing Some Green After Strong Results
886537,2018-10-16 05:21:00-04:00,"12 Stocks To Watch For October 16, 2018"
886538,2018-10-16 04:37:00-04:00,"Earnings Scheduled For October 16, 2018"
886539,2018-10-16 00:00:00-04:00,Fintech Lender OnDeck Spins Out SaaS Company To Build Small Business Loan Products For Banks
886540,2018-10-15 17:26:00-04:00,"10 Hottest Stocks From October 15, 2018"
886541,2018-10-15 16:35:00-04:00,"Benzinga Pro's Top 10 Most-Searched Tickers For Afternoon Of Mon., Oct. 15, 2018"
886542,2018-10-15 13:05:00-04:00,"Netflix Earnings Ahead, With Analysts Focused On Subscriber Numbers After Q2 Miss"
886543,2018-10-15 12:57:00-04:00,Goldman Sachs And Morgan Stanley To Report Earnings Tomorrow Amid Wobbly Markets
886544,2018-10-15 12:28:00-04:00,"How Millennials, Baby Boomers Are Reacting To Market Volatility"
886545,2018-10-15 12:06:00-04:00,"The Week Ahead: Q3 Earnings Season, Canada Decriminalizes Cannabis"
886546,2018-10-15 11:16:00-04:00,Netflix Q3 Earnings Preview: A Subscriber Numbers Story
886547,2018-10-15 10:05:00-04:00,Netflix shares are trading down 3.7% after analysts at Goldman Sachs and Raymond James lowered their price targets on the stock.
886548,2018-10-15 10:00:00-04:00,FANG Weakness Drags New Communication Services ETFs
886549,2018-10-15 09:56:00-04:00,10 Biggest Price Target Changes For Monday
886550,2018-10-15 09:41:00-04:00,"As New Week Begins, Markets Still Seem To Be Playing ""D"" Amid Host of Earnings"
886551,2018-10-15 09:24:00-04:00,"Goldman Sachs Maintains Buy on Netflix, Lowers Price Target to $430"
886552,2018-10-15 05:06:00-04:00,44 Biggest Movers From Yesterday
886553,2018-10-15 03:54:00-04:00,Raymond James Lowers Netflix Price Target to $400 from $445
886554,2018-10-14 13:37:00-04:00,"Bulls & Bears Of The Week: GE, Netflix, Nike, Twitter And More"
886555,2018-10-13 12:43:00-04:00,"Barron's Picks And Pans: Apple, Dell, Netflix, Wells Fargo And More"
886556,2018-10-13 12:21:00-04:00,"Midterms And The Stock Market: Potential Winners, Losers From The Coming Election"
886557,2018-10-12 13:52:00-04:00,"Netflix Pops On Citi Upgrade, But Cycles Point The Other Way"
886558,2018-10-12 13:42:00-04:00,41 Stocks Moving In Friday's Mid-Day Session
886559,2018-10-12 10:49:00-04:00,"Shares of tech stocks moving higher as market rebounds from mid-week lows, strength could be related to rotation back into growth names; Netflix up 5.3%, NVIDIA up 5.8%, Salesforce Up 5.1%, PayPal Up 4.4%, Apple up 3.2%, VMWare up 3.0%."
886560,2018-10-12 10:30:00-04:00,Citi's May Says Buy The Dip In Netflix
886561,2018-10-12 09:58:00-04:00,10 Biggest Price Target Changes For Friday
886562,2018-10-12 09:13:00-04:00,"Benzinga's Top Upgrades, Downgrades For October 12, 2018"
886563,2018-10-12 07:58:00-04:00,Citigroup Upgrades Netflix to Buy
886564,2018-10-12 06:59:00-04:00,"Stifel Nicolaus Maintains Buy on Netflix, Lowers Price Target to $395"
886565,2018-10-12 04:32:00-04:00,Citigroup Upgrades Netflix to Buy from Neutral
886566,2018-10-11 17:34:00-04:00,Netflix And Sugar23 Enter Multi-Year Film Deal
886567,2018-10-11 10:08:00-04:00,"After Wednesday Wash-Out, Comeback Might Be In Store As Rates Ease, Data Support"
886568,2018-10-11 07:28:00-04:00,Dan Deming's Options Trade Ahead Of Netflix's Earning
886569,2018-10-10 16:29:00-04:00,"Dow Falls 1,300 Points In 48 Hours As Market Rout Continues"
886570,2018-10-10 09:46:00-04:00,On The Rate Watch: Yields Still Driving Action As Inflation Data Roll In
886571,2018-10-09 15:18:00-04:00,"Is Spotify The New Netflix? Yes And No, Says MKM Partners"
886572,2018-10-09 10:31:00-04:00,"Investors Seem To Be Fretting About Rising Yields, Global Economic Growth"
886573,2018-10-08 15:43:00-04:00,Walmart Is Looking To Enhance Vudu With Metro-Goldwyn-Mayer Deal
886574,2018-10-08 15:16:00-04:00,'Netflix chooses New Mexico for its new US video production hub' -San Francisco Chronicle Reports
886575,2018-10-08 13:46:00-04:00,Imperial Capital's Bullish Stance On Netflix Unchanged Ahead Of Q3 Print
886576,2018-10-08 12:33:00-04:00,3 Reasons To Buy Iqiyi – The 'Netflix Of China' – According To Jefferies
886577,2018-10-08 12:02:00-04:00,What's Next For FANG Stocks After Recent Weakness?
886578,2018-10-05 08:09:00-04:00,"Altria, CBS, IBM, Netflix: 'Fast Money' Picks For October 5"
886579,2018-10-05 08:04:00-04:00,Todd Gordon's Bearish Netflix Options Trade
886580,2018-10-04 16:06:00-04:00,Hudson Pacific Properties Leases Hollywood Office Tower to Netflix
886581,2018-10-04 13:27:00-04:00,'Europe moves forward with content quotas for Netflix and Amazon' -Engadget
886582,2018-10-04 12:20:00-04:00,How Growth And Value ETFs Look After The Debut Of Communication Services
886583,2018-10-03 13:22:00-04:00,Netflix To Develop Series And Films Based On 'Chronicles Of Narnia' Franchise
886584,2018-10-02 15:50:00-04:00,Netflix Who? 3 Media Stocks That Look Like They're Back In Favor
886585,2018-10-02 12:44:00-04:00,"HBO Ends 45-Year Run With Boxing, Says Sport No Longer A Subscription Driver"
886586,2018-10-01 15:57:00-04:00,UPDATE: Amazon Has Reportedly Been In Discussions With At Least Three Major Media Companies To Bring Their Programming To The New Fire TV Service
886587,2018-10-01 15:55:00-04:00,"Amazon Subsidiary, IMBD, Is Expected To Announce A Free, Ad-Supported Video Service For Amazon Fire TV Users This Week"
886588,2018-10-01 07:25:00-04:00,Hearing Netflix Is Developing A Slate Of Specials In Which Viewers Can Choose The Next Storyline In A TV Episode Or Movie; Shares Unaffected
886589,2018-09-29 10:04:00-04:00,9 Streaming Services With The Best Original Content
886590,2018-09-28 10:19:00-04:00,"As Wall Street Awaits Main Earnings Season, Trade, Tesla Appear To Be In Focus"
886591,2018-09-28 08:09:00-04:00,Netflix Says Its On Track To Exceed Half Billion Dollar Investment In Netflix Canada
886592,2018-09-25 12:28:00-04:00,Nomura's Case For Adding Square To The FANG Trade
886593,2018-09-25 10:32:00-04:00,Having Some Ups And Downs: Market See-Saw Ride Seen Likely To Continue
886594,2018-09-24 15:22:00-04:00,Infographic: Millennials Give Moviegoing A Boost
886595,2018-09-22 16:06:00-04:00,"Benzinga's Bulls & Bears Of The Week: Amazon, Caterpillar, Costco, Netflix, More"
886596,2018-09-21 13:12:00-04:00,"From Facebook To Netflix: The S&P's Big Sector Shakeup, Explained"
886597,2018-09-20 18:19:00-04:00,How AMC Plans To Reanimate 'The Walking Dead' For 10 More Years
886598,2018-09-19 15:23:00-04:00,Guggenheim: Netflix Subscriber Penetration Will Outpace Street Expectations
886599,2018-09-19 10:22:00-04:00,"Stock Market Appears To Focus On US-China Tariff News As US, Canada Continue Talks"
886600,2018-09-19 09:56:00-04:00,10 Biggest Price Target Changes For Wednesday
886601,2018-09-19 08:55:00-04:00,"Guggenheim Raises Netflix Price Target From $360 To $420, Firm Says Investments Keep Netflix's Quality Content Creation Unique; Believes Upgrades To User Experience And Consumer Products Development Support Share Appreciation"
886602,2018-09-19 08:50:00-04:00,"Netflix Shares Up 1.7% Premarket, Recently Broke Above $372.50 Technical Level; Guggenheim Earlier Raised Price Target On Stock From $360 To $420"
886603,2018-09-18 12:45:00-04:00,Mike Khouw Sees Unusual Options Activity In Netflix
886604,2018-09-17 15:30:00-04:00,"IMAX In Talks With Streaming Services Such As Netflix To Release Their Movies, Business Insider Reports"
886605,2018-09-17 14:55:00-04:00,SunTrust Continues To See Upside Potential In Netflix's Q3
886606,2018-09-17 10:02:00-04:00,"Trade Winds Keep Blowing, Potentially Putting A Barrier On Rally Chances"
886607,2018-09-17 04:07:00-04:00,Flipkart Considers Stake in Video Streaming Service Hotstar
886608,2018-09-14 09:01:00-04:00,"Netflix To Report Q3 Earnings Tues., Oct. 16, 2018 After Market Close"
886609,2018-09-13 10:43:00-04:00,"Air Of Cautious Optimism To Start Day On Positive China Talk, Easing Price Fears"
886610,2018-09-12 11:57:00-04:00,The Communication Services Sector Is Almost Here
886611,2018-09-12 10:27:00-04:00,"Market Appears To Be in Wait-and-See Mode Ahead of Apple, Central Bank Events"
886612,2018-09-07 21:20:00-04:00,EXCLUSIVE: Mark Cuban Short 2 Biotech Stocks
886613,2018-09-07 10:02:00-04:00,"Solid Employment Report, But Tech Selloff Enters Fourth Day"
886614,2018-09-06 16:04:00-04:00,This Chart Shows Why Netflix Is Primed For A Tumble
886615,2018-09-06 15:42:00-04:00,"Netflix Rises On Upgrade, But Market Cycles Point Lower"
886616,2018-09-06 12:00:00-04:00,Netflix: A Bull-Bear Debate
886617,2018-09-06 10:03:00-04:00,Clock Ticking On Canada Trade Talks While Sector Rotation Seen
886618,2018-09-06 09:09:00-04:00,Netflix Shares Up 2% Premarket After RBC Earlier Reiterated Its Outperformd Rating On The Shares and Lifted Its Price Target From $360 to $440
886619,2018-09-06 09:01:00-04:00,"Major tech and social media stocks appear to be modestly rebounding after closing down Wednesday amid Congressional hearings with Facebook and Twitter; Netflix up 2.1%, Snap up 0.4%, Twitter up 0.4%, Facebook up 0.2%, Alphabet up 0.2%."
886620,2018-09-05 15:20:00-04:00,"Tech Stocks Fall Amid Twitter, Facebook Senate Testimonies"
886621,2018-09-05 11:50:00-04:00,"Major tech and social media stocks trading down as executives from Twitter and Facebook testify in front of US Congress; Facebook down 1.7%, Alphabet down 2.4%, Netflix down 4.3%, Snap down 4.6%, Twitter down 5.1%."
886622,2018-09-05 11:06:00-04:00,Infographic: Google Through The Years
886623,2018-09-05 10:31:00-04:00,A Timely ETF For September
886624,2018-09-05 10:04:00-04:00,Morgan Stanley Raises Apple's Price Target On Video Optimism
886625,2018-08-27 14:41:00-04:00,UPDATE: Rachel Whetstone Named Netflix Chief Communications Officer
886626,2018-08-27 14:36:00-04:00,Facebook Comms Exec Rachel Whetstone Reportedly Leaving To Join Netflix
886627,2018-08-25 17:33:00-04:00,"Benzinga's Bulls & Bears Of The Week: Alibaba, Apple, Nike, Tesla, Verizon And More"
886628,2018-08-24 13:42:00-04:00,"Buy Netflix On The Pullback, SunTrust Says"
886629,2018-08-24 10:14:00-04:00,Netflix shares are trading up 3%; Traders circulating word of positive commentary by analyst at M Science.
886630,2018-08-24 10:05:00-04:00,10 Biggest Price Target Changes For Friday
886631,2018-08-24 09:38:00-04:00,"Netflix Shares Appear Unaffected As Traders Circulate Word Of Positive Commentary By Analyst At Data-Driven Research, Analytics Firm, M Science"
886632,2018-08-24 09:13:00-04:00,"Benzinga's Top Upgrades, Downgrades For August 24, 2018"
886633,2018-08-24 06:58:00-04:00,"SunTrust Robinson Humphrey Upgrades Netflix to Buy, Lowers Price Target to $410"
886634,2018-08-23 17:02:00-04:00,Have You Tried The New Benzinga Pro Chat Beta Yet? We Often Discuss Hot Stocks And The Recent Breaking News Items Over The Last Few Mins.; Check It Out At https://pro.benzinga.com/popout/widget/chat/
886635,2018-08-23 10:07:00-04:00,"Fed On Center Stage As Jackson Hole Meeting Starts, With Powell Speech Friday"
886636,2018-08-23 07:26:00-04:00,"UPDATE: Imperial On Netflix Notes 'Apple realizes a 30% fee on the first year of a subscription enacted through the app store, which reverts to 15% in subsequent years.'"
886637,2018-08-23 07:25:00-04:00,"UPDATE: Imperial On Netflix: 'In the co.'s quest to expand margins within the int'l. bucket, eliminating the fees it pays to Apple for acting as a ""gatekeeper"" within the confines of the app store is a top priority.'"
886638,2018-08-23 06:55:00-04:00,UPDATE: Imperial On Netflix Highlights Recent Reports Suggesting Co. Is Experimenting In 33 Countries To Remove Capability For New Subs To Sign Up Via Apple App Store
886639,2018-08-23 06:53:00-04:00,"Imperial Capital Maintains Outperform, $494 Price Target On Netflix; Raises FY18 EPS Estimate 'to account for a slight improvement in int'l. subscribership'"
886640,2018-08-22 17:24:00-04:00,Verizon: The Dow Powerhouse Few Are Discussing
886641,2018-08-22 15:37:00-04:00,Cramer: The Bull Run Survived These 10 Challenges
886642,2018-08-22 14:00:00-04:00,Netflix Vs. Amazon Vs. Nvidia: Picking A Tech Stock For The Long Haul
886643,2018-08-22 09:47:00-04:00,10 Biggest Price Target Changes For Wednesday
886644,2018-08-21 10:41:00-04:00,William Blair Predicts Netflix Shares Will Hit $660 By 2024
886645,2018-08-21 07:35:00-04:00,Mike Khouw Sees Unusual Options Activity In Netflix
886646,2018-08-20 14:36:00-04:00,'Netflix tests out ads for other shows in between episodes' - CNBC Reports
886647,2018-08-19 11:55:00-04:00,"Benzinga's Bulls & Bears Of The Week: Facebook, Netflix, Twitter, Walmart And More"
886648,2018-08-16 12:52:00-04:00,Netflix's Race Against Time
886649,2018-08-15 10:23:00-04:00,"Q2 13F Roundup: How Buffett, Einhorn, Loeb And Others Adjusted Their Portfolio"
886650,2018-08-14 17:13:00-04:00,"13F From Soros Fund Shows Exited Stake In Fiat Chrysler, Exited Stake In NVIDIA; Reduced Stake In JP Morgan, Netflix; Raised Stake In Lululemon"
886651,2018-08-14 11:10:00-04:00,Omega Advisors 13F Shows Dissolved 65K Share Stake In Netflix
886652,2018-08-14 09:42:00-04:00,KeyBanc: CFO's Retirement To Cause 'Minimal Disruption' At Netflix
886653,2018-08-13 15:46:00-04:00,"Benzinga Pro's Top 10 Most-Searched Tickers Monday, August 13th"
886654,2018-08-13 15:17:00-04:00,"Mark Cuban Talks Musk, Netflix, Amazon And More"
886655,2018-08-13 13:14:00-04:00,"No Surprise: FAANG's A Big Deal For Growth Indexes, ETFs"
886656,2018-08-13 13:11:00-04:00,UPDATE: Mark Cuban on CNBC Earlier Mentioned Amazon and Netflix Remain His Largest Holdings
886657,2018-08-13 12:57:00-04:00,"Mark Cuban On CNBC Says He Doesn't Believe Netflix CFO's Departure Is A Significant Negative, Hasn't Sold Any Of His Shares"
886658,2018-08-13 11:41:00-04:00,Longtime Netflix CFO David Wells To Leave Company
886659,2018-08-13 09:00:00-04:00,Netflix Announces CFO David Wells to Step Down
886660,2018-08-08 17:29:00-04:00,"What's Your Brand Promise? Customer Data, Cybersecurity, Compliance, And Trust"
886661,2018-08-08 16:36:00-04:00,Roku Reported Launch Of Free Streaming Service: The Roku Channel For Web
886662,2018-08-08 10:48:00-04:00,"Disney's Quarter Is A Direct-To-Consumer Story, Says RBC Analyst"
886663,2018-08-07 16:10:00-04:00,The Highs And Lows Of Earnings Season Dominate July's IMX Results
886664,2018-08-07 10:56:00-04:00,The End Of The FANG Era? Gene Munster Makes The Case
886665,2018-08-07 09:12:00-04:00,Investor Movement Index July Summary
886666,2018-08-06 10:10:00-04:00,Should Investors Take Some 'Chips Off The Table' Or Sell Before 'Rolling Bear Market' Begins?
886667,2018-08-03 12:34:00-04:00,More Leveraged FANG ETNs Are Here
886668,2018-08-02 13:11:00-04:00,Netflix To Pay ~$7.2M To Settle Litigation With Relativity
886669,2018-08-02 11:44:00-04:00,"The iQIYI Growth Story Is Priced In, Goldman Says In Downgrade"
886670,2018-08-01 10:39:00-04:00,Strong Apple Results Compete With Trade Worries For Investor Sentiment Ahead Of Fed
886671,2018-08-01 08:18:00-04:00,The 'Shark Tank Of Cannabis' Debuts On Amazon Prime With Millions To Distribute
886672,2018-07-31 10:34:00-04:00,Market Appears More Optimistic Following Tech-Led Selloff
886673,2018-07-31 10:22:00-04:00,Cramer's 'Clear Winners' From Earnings Season So Far
886674,2018-07-31 09:58:00-04:00,Pro: FAANG Stocks Could Have 30-40% Downside Potential
886675,2018-07-31 08:56:00-04:00,This De-FAANGed ETF Avoided Facebook's Slump
886676,2018-07-30 10:16:00-04:00,"CAT Climbs Into Driver's Seat To Start Earnings Parade, With Fed Meeting Ahead"
886677,2018-07-30 09:44:00-04:00,Netlix Shares Down 4.15% Off The Open At ~$340/Share
886678,2018-07-27 15:44:00-04:00,Which Is The Better Buy: Netflix Or China's Fast-Growing Iqiyi?
886679,2018-07-27 13:52:00-04:00,"Breaking Down Spotify's Q2 Earnings: It's Premium User Growth And Nothing Else, For Now"
886680,2018-07-27 11:41:00-04:00,"A Fairy-Tale Ending: Disney, Fox Shareholders Approve Merger"
886681,2018-07-27 10:01:00-04:00,Economic Growth Hits Best Level Since 2014 As Earnings Season Keeps Rolling
886682,2018-07-26 10:06:00-04:00,"Nasdaq, Tech Names Might Come Under Pressure Following Facebook's Weak Results"
886683,2018-07-25 18:02:00-04:00,"Social Media, FANG Stocks Taking A Big Hit In After-Hours Trading"
886684,2018-07-25 17:52:00-04:00,"Social Stocks Following Facebook Lower After Hours After Its Mixed Q2 Report: Facebook -16.8%, Twitter -5.9%, Snap -3.1%; FANG Stocks Also Lower: Amazon -2.2%, Netflix -2.9%, Alphabet -1%"
886685,2018-07-25 16:14:00-04:00,"Facebook Shares Down ~8.5% To $199.35 Following Q2 Earnings Release; Amazon, Netflix Both Fall ~1% In Sympathy"
886686,2018-07-23 16:18:00-04:00,"Technology Select Sector SPDR ETF Up 0.7% After Hours Following Alphabet Earnings Beat, 5% Move Higher; Amazon Shares Up 0.7%, Facebook Up 0.9%, Netflix Up 0.2%"
886687,2018-07-22 17:24:00-04:00,"Benzinga's Bulls & Bears Of The Week: AbbVie, Netflix, Philip Morris, Wells Fargo And More"
886688,2018-07-22 17:14:00-04:00,"Barron's Picks And Pans: Autoliv, BlackRock, Boeing, Netflix And More"
886689,2018-07-19 15:53:00-04:00,Some Perspective On Netflix's Subscriber Figures
886690,2018-07-19 11:00:00-04:00,"'Walmart is, in fact, looking to launch a subscription VOD product - story coming shortly'-Variety Editor Todd Spangler Tweets"
886691,2018-07-19 09:50:00-04:00,"Comcast Ends Pursuit Of Fox Assets, Will Focus On Sky"
886692,2018-07-18 15:46:00-04:00,"Benzinga Pro's Top 10 Most-Searched Tickers For Afternoon Of Wed., Jul. 18, 2018"
886693,2018-07-18 13:30:00-04:00,Netflix To Bring Comedy To New Sirius XM Channel
